[
  {
    "connectionId": "1",
    "permissionId": "5c945d84-8120-4f30-9c69-2dc1dbbb4a43",
    "dataNeedId": "9bd0668f-cc19-40a8-99db-dc2cb2802b17",
    "dataSourceInformation": {
      "countryCode": "DE",
      "meteredDataAdministratorId": "sim",
      "permissionAdministratorId": "sim",
      "regionConnectorId": "sim"
    },
    "timestamp": "2026-07-13T00:00:00.000000000Z",
    "status": "CREATED",
    "message": "",
    "additionalInformation": null
  },
  {
    "connectionId": "1",
    "permissionId": "5c945d84-8120-4f30-9c69-2dc1dbbb4a43",
    "dataNeedId": "9bd0668f-cc19-40a8-99db-dc2cb2802b17",
    "dataSourceInformation": {
      "countryCode": "DE",
      "meteredDataAdministratorId": "sim",
      "permissionAdministratorId": "sim",
      "regionConnectorId": "sim"
    },
    "timestamp": "2026-07-13T00:00:00.000000000Z",
    "status": "VALIDATED",
    "message": "",
    "additionalInformation": null
  }
]
